{
  "$schema": "https://json-schema.org/draft/2020-12/schema",
  "$id": "https://envr.dev/schemas/cli/governance-index.json",
  "version": 2,
  "failure_tiers": {
    "tier0": [
      "argv_parse_error",
      "child_exit",
      "project_check_failed",
      "project_validate_failed",
      "diagnostics_export_failed"
    ],
    "tier1": [
      "project_sync_pending",
      "shell_exit",
      "aborted"
    ],
    "tier2": [
      "validation"
    ]
  },
  "porcelain_matrix_rows": {
    "list": {
      "row_key": "list",
      "porcelain_expected": true
    },
    "current": {
      "row_key": "current",
      "porcelain_expected": true
    },
    "resolve": {
      "row_key": "resolve",
      "porcelain_expected": true
    },
    "which": {
      "row_key": "which",
      "porcelain_expected": true
    }
  },
  "offline_coverage_rows": {
    "list": {
      "row_key": "list",
      "network_skip_allowed": false
    },
    "current": {
      "row_key": "current",
      "network_skip_allowed": false
    },
    "resolve": {
      "row_key": "resolve / which",
      "network_skip_allowed": false
    },
    "which": {
      "row_key": "resolve / which",
      "network_skip_allowed": false
    },
    "check": {
      "row_key": "status",
      "network_skip_allowed": false
    },
    "status": {
      "row_key": "status",
      "network_skip_allowed": false
    },
    "config_path": {
      "row_key": "config",
      "network_skip_allowed": false
    },
    "config_keys": {
      "row_key": "config",
      "network_skip_allowed": false
    },
    "config_get": {
      "row_key": "config",
      "network_skip_allowed": false
    },
    "config_show": {
      "row_key": "config",
      "network_skip_allowed": false
    },
    "config_set": {
      "row_key": "config",
      "network_skip_allowed": false
    },
    "config_edit": {
      "row_key": "config",
      "network_skip_allowed": false
    },
    "doctor": {
      "row_key": "doctor",
      "network_skip_allowed": false
    },
    "deactivate": {
      "row_key": "deactivate / hook prompt / template / update",
      "network_skip_allowed": false
    },
    "hook_prompt": {
      "row_key": "deactivate / hook prompt / template / update",
      "network_skip_allowed": false
    },
    "template": {
      "row_key": "deactivate / hook prompt / template / update",
      "network_skip_allowed": false
    },
    "run": {
      "row_key": "run / exec",
      "network_skip_allowed": false
    },
    "exec": {
      "row_key": "run / exec",
      "network_skip_allowed": false
    },
    "uninstall": {
      "row_key": "use / uninstall",
      "network_skip_allowed": false
    },
    "cache_clean": {
      "row_key": "cache",
      "network_skip_allowed": false
    },
    "cache_index_status": {
      "row_key": "cache",
      "network_skip_allowed": false
    },
    "bundle_create": {
      "row_key": "bundle",
      "network_skip_allowed": false
    },
    "bundle_apply": {
      "row_key": "bundle",
      "network_skip_allowed": false
    },
    "shim_sync": {
      "row_key": "shim",
      "network_skip_allowed": false
    },
    "project_add": {
      "row_key": "project / prune",
      "network_skip_allowed": false
    },
    "project_sync": {
      "row_key": "project / prune",
      "network_skip_allowed": false
    },
    "prune": {
      "row_key": "project / prune",
      "network_skip_allowed": false
    }
  },
  "offline_coverage_exempt": {},
  "capability_test_rows": {
    "list": { "phase_a_row_key": "list", "json_ok_required": true, "porcelain_required": true },
    "current": { "phase_a_row_key": "current", "json_ok_required": true, "porcelain_required": true },
    "remote": { "phase_a_row_key": "remote", "json_ok_required": true, "porcelain_required": false },
    "doctor": { "phase_a_row_key": "doctor", "json_ok_required": true, "porcelain_required": false },
    "check": { "phase_a_row_key": "status", "json_ok_required": true, "porcelain_required": false },
    "status": { "phase_a_row_key": "status", "json_ok_required": true, "porcelain_required": false },
    "resolve": { "phase_a_row_key": "resolve / which", "json_ok_required": true, "porcelain_required": true },
    "which": { "phase_a_row_key": "resolve / which", "json_ok_required": true, "porcelain_required": true },
    "config_path": { "phase_a_row_key": "config", "json_ok_required": true, "porcelain_required": false },
    "config_keys": { "phase_a_row_key": "config", "json_ok_required": true, "porcelain_required": false },
    "config_get": { "phase_a_row_key": "config", "json_ok_required": true, "porcelain_required": false },
    "config_show": { "phase_a_row_key": "config", "json_ok_required": true, "porcelain_required": false },
    "config_set": { "phase_a_row_key": "config", "json_ok_required": true, "porcelain_required": false },
    "config_edit": { "phase_a_row_key": "config", "json_ok_required": true, "porcelain_required": false },
    "deactivate": { "phase_a_row_key": "deactivate / hook prompt / template / update", "json_ok_required": true, "porcelain_required": false },
    "hook_prompt": { "phase_a_row_key": "deactivate / hook prompt / template / update", "json_ok_required": true, "porcelain_required": false },
    "template": { "phase_a_row_key": "deactivate / hook prompt / template / update", "json_ok_required": true, "porcelain_required": false },
    "update": { "phase_a_row_key": "deactivate / hook prompt / template / update", "json_ok_required": true, "porcelain_required": false },
    "run": { "phase_a_row_key": "run / exec", "json_ok_required": true, "porcelain_required": false },
    "exec": { "phase_a_row_key": "run / exec", "json_ok_required": true, "porcelain_required": false },
    "install": { "phase_a_row_key": "use / uninstall", "json_ok_required": true, "porcelain_required": false },
    "use": { "phase_a_row_key": "use / uninstall", "json_ok_required": true, "porcelain_required": false },
    "uninstall": { "phase_a_row_key": "use / uninstall", "json_ok_required": true, "porcelain_required": false },
    "cache_clean": { "phase_a_row_key": "cache", "json_ok_required": true, "porcelain_required": false },
    "cache_index_status": { "phase_a_row_key": "cache", "json_ok_required": true, "porcelain_required": false },
    "shim_sync": { "phase_a_row_key": "shim", "json_ok_required": true, "porcelain_required": false },
    "rust_install_managed": { "phase_a_row_key": "rust", "json_ok_required": true, "porcelain_required": false },
    "bundle_create": { "phase_a_row_key": "bundle", "json_ok_required": true, "porcelain_required": false },
    "bundle_apply": { "phase_a_row_key": "bundle", "json_ok_required": true, "porcelain_required": false },
    "project_add": { "phase_a_row_key": "project / prune", "json_ok_required": true, "porcelain_required": false },
    "project_sync": { "phase_a_row_key": "project / prune", "json_ok_required": true, "porcelain_required": false },
    "project_validate": { "phase_a_row_key": "project / prune", "json_ok_required": true, "porcelain_required": false },
    "prune": { "phase_a_row_key": "project / prune", "json_ok_required": true, "porcelain_required": false }
  },
  "capability_test_exempt": {}
}
